title,url,author,date,text,images,keyword,item_index
다계정 나이스 워디 무제한 양산 작전 괜찮을듯,https://www.inven.co.kr/board/lostark/6271/2050325, Wmod,2025-05-27 13:05,마효증 바리 2장 유각에 뾰루지  유각 45장에 중하 악세 + 9겁작 돌려먹기  완전 균등 쌀먹 세팅해도 즐로아 1400점 나오네,다계정_나이스_워디_1.jpg,유각,65200605; 65201505; 65203105; 65203905; 65200805; 65203305; 65204105; 65201005; 65203705; 65203505; 65202805; 65200505; 65203005
ㅋㅋㅋㅋ 꺼드럭거릴려고 10겁작 다 샀는데,https://www.inven.co.kr/board/lostark/6271/2050311, 회피의달인,2025-05-27 13:04,"라방 두세번 더 하면 너도나도 10겁작이라 꺼드럭도 못하겠누  올유각 25강 무품백 97돌 17퍼팔찌 다 해놨는데 알피지 게임에서 스펙으로 꺼드럭거리지도 못하네  명예보상 준비중인거 잘 하고 있으려나 일 안할라고 맨날 공용 펫, 탈것, 배경 이딴거나 쳐내는데",,유각,65200605; 65201505; 65203105; 65203905; 65200805; 65203305; 65204105; 65201005; 65203705; 65203505; 65202805; 65200505; 65203005
왜 유각을 사고 보석을 쥐고있지? 다 팔고 현금 쥐고있어야지,https://www.inven.co.kr/board/lostark/6271/2050308, 여시,2025-05-27 13:03,"최근라방 요약하면  대재학 : 의도치 않게 너무 비싼 게임이 됐다. 저희의 의도와 다르다. 싼 게임을 만들겠다.   이게 뭔말이냐.. 다 감가 때려서 가격 낮춰서 누구나 쉽게 8겁8작, 유각, 상재 다 할 수 있게 해준다는건데용..   왜 재화를 손에 쥐고서 악을 쓰시나요? 현금화 하고 기다리기민 하면 대재학께서 싼게임을 만들어 주실거고, 그때 현금으로 들어오면 되는뎅...",,유각,65200605; 65201505; 65203105; 65203905; 65200805; 65203305; 65204105; 65201005; 65203705; 65203505; 65202805; 65200505; 65203005
기조쿠 여러분 고민이 있습니다.,https://www.inven.co.kr/board/lostark/5344/125173, 휘바밤,2025-05-27 13:01,전단유각에 아드1칸인 극특세맥인데 다시 역천해볼까하는데 정단빌드 역천 따로 어디소 볼수 있나여 아니면 정단 버린 특치로 가야할까여 아니면 그대로 세맥해야할까요 고민중,,유각,65200605; 65201505; 65203105; 65203905; 65200805; 65203305; 65204105; 65201005; 65203705; 65203505; 65202805; 65200505; 65203005
보석 감가 된 김에 보석 시스템 구조도 이참에 뜯어 고쳐야 한다.,https://www.inven.co.kr/board/lostark/6271/2050281, 사립오더,2025-05-27 12:59,"유저 이탈 여기서 더 없다고 생각해도 보석감가는 계속 떨어짐.   보석 값이 유지 되거나 오를려면   ""유저들이 보석을 계속 업그레이드 하면서 사용하고 있어야 한다.""    이게 중요한데 지금 로아 방향성은 반대로 가고 있음.   1. 게임을 라이트하게 바꾸겠다.  >> 고렙보석안들어도 클리어에 지장이 없다.    2. 광휘보석 추가 기본공격력증가 철회하겠다.  >> 효율을 위해 선택한 나이스단 게임사에서 막지 않겠다 선언 >> 보석을 귀속할 이유도 없어짐.    3. 보석레벨이 올라갈 수록 골드대비 효율이 안좋다.  >> 시즌2 멸화는 그나마 딜증 퍼센트 차이를 둬서 어느정도 해소 >> 시즌3는 기본공증 증가폭이 증가하지만 거의 의미 없는 수준 >> 고렙보석 낄빠에 유각을 읽거나 다른것에 스팩업 투자로 우선순위 밀림.   4.. 초각성스킬 및 일부 캐릭 구조로 인한 보석 효율 편차가 존재한다.  >> 겁화6개이상 낀 유저 대상으로 작열레벨이 올라갈수록 쿨정렬이 꼬여서 싸이클이 느러지는 기현상발생. >> 일격, 황후, 분망, 역천 등등 초각성스킬+각성기+출혈 딜지분이 극단적으로 높은 직업들의 상대적 낮은 겁화 효율 >> 직업마다 겁화, 작열 효율의 불균형 역대 최고치라 장담 가능.      1,2번은 게임사 운영으로 인한 나락  3,4번은 보석 구조로 인한 나락     1,2번은 솔직히그럴수 있다 침. 게임운영의 방향성이 어찌되었든  모든 유저들이 감내해야하는 부분이고,  보석의 경제적 가치는 상대적이니   근데  3,4번은 뭔 생각으로 방치함?    그냥 기본공증 버리고  초각성스킬 딜증이랑 쿨감을 11개 기준 각 레벨 효율와 동일하게 설정하면  초각성스킬로 인한 밸런스도 조절가능할텐데  왜 기본공증을 쳐 달아둔걸까?   서폿은 초각성스킬 버프 효율 증가 넣어주면 되고 ㅇㅇ     극단적인 예시로  야성(초각성스킬 딜지분 10퍼) 일격(초각성스킬 딜지분 50~60퍼)   가 8겁작>10겁작 통으류 올렸을때  과연 비슷한 효율을 가질까?  일격은 심지어 작열 효율도 의미 없을 정도로 안좋음.   지금은 8겁작이 대세이니 8겁작 기준으로 밸런스패 패치 한다 치자.   나중에 10겁작이 대세면?   10겁작 지표를 기준으로 일격은 상향시키고, 야성은 하향시킬거임?      경제적 가치는 둘째치고  3,4번은 효율적 가치에서  11개 보석을 온전히 쓴다는 가정하에서는 편차가 없어야하는게 정상인데   시즌2땐 변신캐랑 서폿멸화만 문제였다면   시즌3는 초각성스킬 및 아덴기 추가된 몇몇 직업들은  보석으로 인해 상대적으로 효율이 떨어진 상태가 됨.   이게 맞는 밸런스임?  멸화갯수 차이는 멸홍 자율 변환만 들어왔어도 솔직히별 문제 안됐을 문제임.  멸홍 갯수차이는 경제적가치의 문제였지.   근데 지금 보석 시스템 구조?  비싸긴 뒤지게 비싼데  효율이 그냥 이상함.   아 근데 이래 따지면 유각도 마찬가지인가? 띠바   그냥 시즌3은 망한 시즌맞음.   유각, 보석 비싼 스팩업 요소 2개가   그냥 직업간  불합리성 덩어리임.     유각, 보석 그냥 단순하게 바꿔야함.  인벤에서 자주 언급되는 포인트제도 같은걸로    3줄 요약   1. 게임 운영 방향성으로 인한 보석 감가는 당연한 것. 2. 그와중에 직업간 보석효율 밸런스 이상함. 3. 유각이랑 더불어 제일 비싼 스팩업 요소 2개가 직업간 불합리성 덩어리임",,유각,65200605; 65201505; 65203105; 65203905; 65200805; 65203305; 65204105; 65201005; 65203705; 65203505; 65202805; 65200505; 65203005
근데 요새 뾰루지단 있긴햐나?,https://www.inven.co.kr/board/lostark/6271/2050227, 새싹,2025-05-27 12:53,부계정이나 아직 유각읽을레벨대 아닌 뉴비들 제외하곤 골두껍이시즌에 앵간하면 조금이라도 읽지않았음? 심지어 나조차도 부계정 유각 40장됐는데,,유각,65200605; 65201505; 65203105; 65203905; 65200805; 65203305; 65204105; 65201005; 65203705; 65203505; 65202805; 65200505; 65203005
그냥 아예 싹다 그냥 싸그리 모든 스팩업요소 1캐릭 화시켜라 조금의 효율도있어선안됨,https://www.inven.co.kr/board/lostark/6271/2050229, 라면먹는중,2025-05-27 12:53,그냥 어짜피 이렇게된거 보석에 공증 뿐만아니라 이동시 페온까지 붙여서 나와서 나이스단 아이에 겜다접게만들어버리는것도 괜찮겠네 ㅇㅇ 유각도 나이스못하게 캐릭마다 유각 100개 박게만들고 ㅇㅇ 이게맞지않나? 1보석변신캐들도 싹다 보석 스킬별로 나누고 게임에 조금의 효율도 있어선 안되는 거임 ㅇㅇ  모든 스팩업은 무조건 1캐릭 1스팩업으로  보석 이동시 페온 엄청들게만들고   매출에 도움안되는 유저수 단식좀해서 간헐적 유저단식으로 로아가 좀더 건강해지게,,유각,65200605; 65201505; 65203105; 65203905; 65200805; 65203305; 65204105; 65201005; 65203705; 65203505; 65202805; 65200505; 65203005
스펙을 올릴 이유가 없다,https://www.inven.co.kr/board/lostark/6271/2050222, 함버거먹자,2025-05-27 12:52,게임이 재미없어서 현질안한다 스펙을 일정구간이상 올릴이유가 없다 스펙을 그 이상 올리면 흑우다 8겁작 맞추면 다가는데 10겁작 왜함 80이하배럭은 6~7겁작하면 다가는데 뭐하러 더올림 유각없어도 다가는데 유각왜함 게임이 망했는데 스펙업왜함 카르마 같은거도 안해도 80레이드 다가는데 왜함 40다계정이 문제다  겹친게 몇개있어도 인벤에서 항상나오던 로아 보석이든 골드든 감가가 심한이유였는데  이제 여기서 나이스단 억지로 추가하면되는거지?,,유각,65200605; 65201505; 65203105; 65203905; 65200805; 65203305; 65204105; 65201005; 65203705; 65203505; 65202805; 65200505; 65203005
성장시스템 기초설계를 대체 어떤 ㅂㅅ이 한거냐,https://www.inven.co.kr/board/lostark/6271/2050209, Anote,2025-05-27 12:50,"유각이나 카드같은 원정대 단위 스펙업은 계정단위 스펙업은 원래 전직업 공통인게 국룰인데 일부만 적용되는 계정 스펙업이라니 ㅅㅂㅋㅋ  봐서 알겠지만 계정 스펙업이 일부에만 적용되면 그 계정이 그 일부로 쏠릴수밖에 없는게 당연하잖아  그러기 싫었으면 이미 저렴하거나, 저렴해질 예정이거나 해야함 근데 유각은 공언을 해버렸지 “생각하는 가격보다 더 낮아졌다”고   보석도 마찬가지로 특정 스킬을 강화한다는 목적으로 만든거겠지만 각 직업마다 딜 구조, 사이클, 지분 죄다 다른데 이걸 밸런스며 효율이며 어떻게 맞추려고 이따구로 만듬?  걍 보석도 전체딜, 전체쿨감으로 통합해라 나중을 위해서라도 좀 지금 해라  겁작 11개 합쳐서 1개로 만들어서 딜쿨 다 넣던가 겁작 5~6개당 1개로 만들어서 딜따로 쿨따로 하던가  그리고 생각해보니까 왜 게임 정상적으로 하는 유저들이 손해를 봐야되냐? 적어도 중간 합의점을 잡아줄 노력이라도 해야지 지금 비나이스단 접는거 보면 감 안와?  광휘 공증을 그냥 깡으로 해주지말고 그 통합보석 2~3개 귀속해서 원대공유하고 공증을 주면 되잖아  이게 싫으면 그냥 1개로 나이스단 하라그러면 되는거고",,유각,65200605; 65201505; 65203105; 65203905; 65200805; 65203305; 65204105; 65201005; 65203705; 65203505; 65202805; 65200505; 65203005
근데 라방서 시즌바뀔때 안한이유가 뭐래?,https://www.inven.co.kr/board/lostark/6271/2050207, 두원더스,2025-05-27 12:49,보석 자율변환이랑 유각같은 스펙억 요소 갑자기 푼거 이유가 뭐라함? 라방실시간으로 봤는데도 기억이 안나,,유각,65200605; 65201505; 65203105; 65203905; 65200805; 65203305; 65204105; 65201005; 65203705; 65203505; 65202805; 65200505; 65203005
10추글 보면 존나 웃긴게,https://www.inven.co.kr/board/lostark/6271/2050117, Blizzardkib,2025-05-27 12:32,얼마 전까지만 해도  뭐 아드엔 냉장고 원한엔 핸드폰 스위치 이렇게 비싸다고 난리통 칠떄는 언제고   보석 감가 속도 사진은 왜자꾸 올리는건지 모르겠네  뭐 비싸게 가자는거임 라이트하게 가자는거임?  스마게도 이쯤되면 니네가 뭘 원하는지 모르겠다  내가 쓰는 보석이랑 유각 값은 유지하고 게임만 라이트하게 만들라고!!!  마치 옆집 메이플 검밑솔 결정석 너프 됐을떄 쌀숭이들이 한말들이랑 다를게없네,,유각,65200605; 65201505; 65203105; 65203905; 65200805; 65203305; 65204105; 65201005; 65203705; 65203505; 65202805; 65200505; 65203005
유각 5장은 더 뿌림 ㅇㅅㅇ,https://www.inven.co.kr/board/lostark/6271/2050029, 끼리리기기기,2025-05-27 12:13,섬머 로아온 1장 슈모익 컴플리트 1장 카제로스 쇼케이스 1장 카제로스 로드 1장 카제로스 퍼클 1장,,유각,65200605; 65201505; 65203105; 65203905; 65200805; 65203305; 65204105; 65201005; 65203705; 65203505; 65202805; 65200505; 65203005
걍 안쓰는 븅X 각인들 없애면 안되나,https://www.inven.co.kr/board/lostark/6271/2049999, 엉덩이디딤꾼,2025-05-27 12:08,"분쇄의 주먹 , 강령술 뭐 이런 개 병ㅅ 각인 로아 온 서버 내에서 쓰는 사람이 100명은 되나  쳐 써놓을 수 있게 설계를 하던지  강령술 : 죽어버린 진저웨일과 에스더 루테란중 한 명을 20초동안 살려내서 극딜을 넣고 다시 한 줌의 재가 됩니다   ㄹㅇ 여신의 아헤가호 이딴 븅x 각인들만 없었어도 유각들 값 절반정도 줄어 바로 정상화했을듯",,유각,65200605; 65201505; 65203105; 65203905; 65200805; 65203305; 65204105; 65201005; 65203705; 65203505; 65202805; 65200505; 65203005
보석 골드값 나락인데 유각은 괜찮겟쪼,https://www.inven.co.kr/board/lostark/6271/2049996, Tedchang,2025-05-27 12:07,재학이형 유각은 지켜준다햇쟈나,,유각,65200605; 65201505; 65203105; 65203905; 65200805; 65203305; 65204105; 65201005; 65203705; 65203505; 65202805; 65200505; 65203005
광기초각스고민이네요,https://www.inven.co.kr/board/lostark/5341/149253, 북극불곰,2025-05-27 11:41,무마마용광기에 마효증유각인데 취향은 블슬인데 퓨메가 더 좋다 이런말도있고 결정하질 못하겠네여 ㅠㅠ,,유각,65200605; 65201505; 65203105; 65203905; 65200805; 65203305; 65204105; 65201005; 65203705; 65203505; 65202805; 65200505; 65203005
보석 골드값 나락인데 유각은 괜찮겟쪼,https://www.inven.co.kr/board/lostark/6271/2049996, Tedchang,2025-05-27 12:07,재학이형 유각은 지켜준다햇쟈나,,유각,65200605; 65201505; 65203105; 65203905; 65200805; 65203305; 65204105; 65201005; 65203705; 65203505; 65202805; 65200505; 65203005
광기초각스고민이네요,https://www.inven.co.kr/board/lostark/5341/149253, 북극불곰,2025-05-27 11:41,무마마용광기에 마효증유각인데 취향은 블슬인데 퓨메가 더 좋다 이런말도있고 결정하질 못하겠네여 ㅠㅠ,,유각,65200605; 65201505; 65203105; 65203905; 65200805; 65203305; 65204105; 65201005; 65203705; 65203505; 65202805; 65200505; 65203005
이거 내가 예민한거?,https://www.inven.co.kr/board/lostark/6271/2049770, 감자칩둘둘,2025-05-27 11:28,어제 레이드 했는데 다른팟 바드가 계속 한번씩 핑 찍는거   첨엔 뭐지 싶어서 핑 의도 찾다가 못 찾아서 물어봤더니   힘구 섬구 나올때마다 찍는거였음 ㅅㅂ 진짜 레이드내내 핑 소리 들으니 정신나갈뻔했어 씨발...  구동 유각도 다 읽은거면 이해하겠는데 한칸 켜져있는거보고 대화 안통할꺼 같아서 포기함  핑 소리 너무 날카롭지않니...,이거_내가_예민한거_1.png,유각,65200605; 65201505; 65203105; 65203905; 65200805; 65203305; 65204105; 65201005; 65203705; 65203505; 65202805; 65200505; 65203005
10겁작 풀유각 나이스단으로써 말하자면,https://www.inven.co.kr/board/lostark/6271/2049738, Mocchinu,2025-05-27 11:21,그거 다 끼고 2300점이면 걔가 2300점중에서 제일약함  유각은 꽤 괜찮은편이지만 보석은 주는 점수에 비해서 딜증가량이 상당히 처참한편임,,유각,65200605; 65201505; 65203105; 65203905; 65200805; 65203305; 65204105; 65201005; 65203705; 65203505; 65202805; 65200505; 65203005
유일한 해결책,https://www.inven.co.kr/board/lostark/6271/2049723, 늙은호랑이,2025-05-27 11:19,"실책인정하고 전재학씨가 디렉터직 내려놓고  최현준씨나 다른 디렉터 앉히고  카제로스 잡고 시즌 3.5 프리시즌열고 쳐낼거 다 쳐내자  게임 방향성 이왕 라이트하게 잡은거  직변권 한장씩 주고, 서버이전 열고 보석 어빌리티스톤 유각 마일리지 싹다 개편때리자  매출포기한다며 당장 떠날애들 떠나라하고 남을애들 남기면서 겨울에 새 시즌 넘어가는거 말곤 방법이없다.",,유각,65200605; 65201505; 65203105; 65203905; 65200805; 65203305; 65204105; 65201005; 65203705; 65203505; 65202805; 65200505; 65203005
걍 보석 문제는,https://www.inven.co.kr/board/lostark/6271/2049688, Sindo120,2025-05-27 11:12,9겁 10겁 4퍼씩밖에 안오르는게 문제임 시즌 2 오래 하던 사람들 대부분 8겁작으로 시작했을텐데 다른 좋은 유각 상재 악세에 투자 안하고 9겁 10겁 맟출 이유가 없음,,유각,65200605; 65201505; 65203105; 65203905; 65200805; 65203305; 65204105; 65201005; 65203705; 65203505; 65202805; 65200505; 65203005
로펙 스펙업질문,https://www.inven.co.kr/board/lostark/6271/2049633, 빙다다단,2025-05-27 11:03,중하짜치는거알아 상중 이상으로 바꾸려고 돈모으다가 유각먼저해서 이렇게됐어.. 근데 이 내용 뭘어케바꾸라는건지 잘 이해가안됨,로펙_스펙업질문_1.png,유각,65200605; 65201505; 65203105; 65203905; 65200805; 65203305; 65204105; 65201005; 65203705; 65203505; 65202805; 65200505; 65203005
보석이 비싸고 유각이 비싸다 할때는 언제고...,https://www.inven.co.kr/board/lostark/6271/2049636, 초이스인성,2025-05-27 11:03,이제 와서 보석 가격 폭란 한다고 우는중...ㅜㅜ,,유각,65200605; 65201505; 65203105; 65203905; 65200805; 65203305; 65204105; 65201005; 65203705; 65203505; 65202805; 65200505; 65203005
유각 수급관련패치는 바로 패치들어와도 되는거아님?,https://www.inven.co.kr/board/lostark/6271/2049624, 엣지,2025-05-27 11:01,두꺼비 연장없는건 좋음. 근데 수급량 늘리겠다고 했는데 이걸 로아온때까지 기다리는게 맞음?,,유각,65200605; 65201505; 65203105; 65203905; 65200805; 65203305; 65204105; 65201005; 65203705; 65203505; 65202805; 65200505; 65203005
보석감가는 전재학이 의도한 현상이다,https://www.inven.co.kr/board/lostark/6271/2049590, 지나가던아델,2025-05-27 10:55,"라방에서 유각 너무 싼거 같다< 한마디에 폭삭 올랏수다 찍는데  얘네가 정말 몰랐을까?   자기말 한마디 한마디에 모든 경제가 움직이는데, 이놈들이 모를리가 없음..   이 또한 스마게와 전재학이 의도한 부분이 분명하다..   안그랬으면 비나이스단, 나이스단 갈라치기 시전했겠음?   지들도 알고 있으니까 눈돌릴곳 필요해서 갈라치기 한거지 ㅋㅋ  개시발전재학 ~~~",보석감가는_전재학이_1.jpg,유각,65200605; 65201505; 65203105; 65203905; 65200805; 65203305; 65204105; 65201005; 65203705; 65203505; 65202805; 65200505; 65203005
원한유각 아드유각 먹으면 뭐하냐,https://www.inven.co.kr/board/lostark/6271/2049581, 찌찌감별사,2025-05-27 10:54,8겁작 한세트만 들고있어도 주에 50만골이 삭제되는데 ㅋㅋ 재학아 뛰발 나좀 살려줘,,유각,65200605; 65201505; 65203105; 65203905; 65200805; 65203305; 65204105; 65201005; 65203705; 65203505; 65202805; 65200505; 65203005
로아는 레이드난이도를 좀 디테일하게 세분화하긴 해야돼,https://www.inven.co.kr/board/lostark/6271/2049559, 노랑개굴이,2025-05-27 10:49,이지 - 사살상싱글 모드를 8명이서 하는 수준 [귀속골드 70프로] 노말 - 물딱렙도 깰 수 있다 [귀속골드 50프로] 하드 - 우리가 지금 가는 노말정도  [귀속골드 30프로] 헬 - 우리가 아는 완화전의 하드 [귀속골드 없음] 신화 - 우리가 아는 지금 헬 [거가 골드 150프로 8명전부 유각득],,유각,65200605; 65201505; 65203105; 65203905; 65200805; 65203305; 65204105; 65201005; 65203705; 65203505; 65202805; 65200505; 65203005
부계정 올려줘도되나?,https://www.inven.co.kr/board/lostark/6271/2049554, Rescene,2025-05-27 10:48,빨아먹을만큼 빨아먹은 초장기주차라인 1660폿 나이스단 6캐릭있는디  1680에 7겁작 둘러주면 애지간한숙제는 돌릴만하지않음? 1680라인에 유각보거나 하진않잖아..?  오바임?,,유각,65200605; 65201505; 65203105; 65203905; 65200805; 65203305; 65204105; 65201005; 65203705; 65203505; 65202805; 65200505; 65203005
왜 아직도 보석 유각을 보고 수락할지 말지 고민하는 사람이 많냐,https://www.inven.co.kr/board/lostark/6271/2049537, Sindo120,2025-05-27 10:46,걍 폿은 악세 팔찌나 봐라 그게 본체고 그게 차이 ㅈ된다,,유각,65200605; 65201505; 65203105; 65203905; 65200805; 65203305; 65204105; 65201005; 65203705; 65203505; 65202805; 65200505; 65203005
보석 다팔아라 더퍼 존나 싸게 하는법 알았다,https://www.inven.co.kr/board/lostark/6271/2049505, 녕안녕안,2025-05-27 10:41,더퍼간다고 9-10겁작 사고 상상악세에 유각  다 부질없다  레벨만 맞추고 다팔고  더퍼 버스타면 끝이다  버스비가 감가쳐먹는거보다 훨씬 싸다  500만골이여도 100만원이다,,유각,65200605; 65201505; 65203105; 65203905; 65200805; 65203305; 65204105; 65201005; 65203705; 65203505; 65202805; 65200505; 65203005
아니 그래서 냉장고값으로 가겠다는거야 안가겠다는거야?,https://www.inven.co.kr/board/lostark/6271/2049458, 게임기획자,2025-05-27 10:34,유각 적정가라고?  그럼 냉장고겜이잖아  냉장고이미지 탈피하겠다고?  먼말이야?  유체이탈이야?,아니_그래서_냉장고_1.jpg,유각,65200605; 65201505; 65203105; 65203905; 65200805; 65203305; 65204105; 65201005; 65203705; 65203505; 65202805; 65200505; 65203005
내가만약에 본캐서폿이 딜러였다면?을 가정해서 만들어봤는데,https://www.inven.co.kr/board/lostark/6271/2049434, 새싹,2025-05-27 10:29,대충 이정도면 맞는지 모르겠음 강화 엘릭서 카르마 초월은 똑같이 맞춤 악세는 내꺼 상상목걸이 150만골-> 딜러 상중목걸이로 치환 무공퍼상에 무공중 귀걸이 10만골->딜러 상하귀걸이로 치환 반지 상상악세 150만골->딜러 상상악세로 치환 서폿 올유각 귀찮으니 뭉뚱그려서 저받 유각 20장으로 치환 공짜로 선택유각주머니에서 먹었다고 가정한 원한 5장 본캐팔찌 13퍼 팔찌니 지금 내딜러가 끼고있는 10퍼팔찌에서 무공하옵 한번 붙여봄(이게 제일 퍼센트가 애매해서 암거나 낮아보이는거 붙임) 어빌돌 96돌으로 똑같이 맞춤  그래도 내 서폿이 딜러로 따져도 풍근은 아니었구나 싶어서 안심함,내가만약에_본캐서폿_1.jpg,유각,65200605; 65201505; 65203105; 65203905; 65200805; 65203305; 65204105; 65201005; 65203705; 65203505; 65202805; 65200505; 65203005
내 지인중에 아드한칸단 있는데,https://www.inven.co.kr/board/lostark/6271/2049430, 익스플로전,2025-05-27 10:29,"골드 존나 쌓아놓고 유각 타이밍 본다고 (아마 유각 다 읽고도 남을정도로 쌓였을거임 지금)  올해 2월부터 아가리쩌억 존버>폭등>매수실패>아가리쩌억 존버>폭등>매수실패 반복하다가  라방 때마다 ""이번 라방만 보고 읽을지 말지 결정해야지"" x99 하더니 이번 골두꺼비때도 ""아 그래도 아직은 아님. 이번 라방때 더 떨어질거야 ㅇㄱㄹ쩌억"" 하다가 라방직후 폭등해서 결국 또 못읽음 ㅋㅋㅋㅋㅋㅋ  로아가 아니라 주식을 하고있던데 근데 이런사람 로아에 꽤 많을거 같음",내_지인중에_아드한_1.gif,유각,65200605; 65201505; 65203105; 65203905; 65200805; 65203305; 65204105; 65201005; 65203705; 65203505; 65202805; 65200505; 65203005
ㅇㅎ) 나이스단은 천천히 말라 죽을거 같긴함,https://www.inven.co.kr/board/lostark/6271/2049423, 퍼리전공사원,2025-05-27 10:28,"지금은 보석, 유각이 같이 사용 할 수 있는 스팩이였지만  앞으로 계속 엘리서,초월,카르마 같은 귀속 스팩업만 줄줄이 나오면  같은 직업을 키운 장점이 점점 미미해지는 거잖음",ㅇㅎ)_나이스단은_1.jpg,유각,65200605; 65201505; 65203105; 65203905; 65200805; 65203305; 65204105; 65201005; 65203705; 65203505; 65202805; 65200505; 65203005
재학이형이 로아 살리는법 알려줌,https://www.inven.co.kr/board/lostark/6271/2049377, 드멘5,2025-05-27 10:19,유각값 박살내고 보석값 올리면 댐 10겁작에 악세처럼 랜덤 능력치 가챠로 박고 한번 누르는골드는 1만골 좋은 옵션 뜰 확률 0.14퍼 그리고 유각은 새로운 큐브 하나 만들어서 거기에 클리어시 유각 선택권 확정으로 주고 큐브 입장권 패키지 팔면 매출도 오름,,유각,65200605; 65201505; 65203105; 65203905; 65200805; 65203305; 65204105; 65201005; 65203705; 65203505; 65202805; 65200505; 65203005
유각 가격이 내려가는거같은데,https://www.inven.co.kr/board/lostark/6271/2049361, 고양이하루,2025-05-27 10:17,화요일이라 그런가? 수욜되면 골드캐고 다시 오를려나,,유각,65200605; 65201505; 65203105; 65203905; 65200805; 65203305; 65204105; 65201005; 65203705; 65203505; 65202805; 65200505; 65203005
근데 생각보다 카던 유각드랍은 안불타네,https://www.inven.co.kr/board/lostark/6271/2049353, Rescc,2025-05-27 10:16,강습기간동안 유각드랍률 내렸다가 최근에 풀었는데 확실히 스마게는 유저를 원숭이로 보는듯,,유각,65200605; 65201505; 65203105; 65203905; 65200805; 65203305; 65204105; 65201005; 65203705; 65203505; 65202805; 65200505; 65203005
