title,url,author,date,text,images,keyword,item_index
선생님들 모코코 직업하나만 추천해주세요,https://www.inven.co.kr/board/lostark/6271/2044353, 왕왕,2025-05-26 14:15,일단저는 오베때부터 열심히하다가 욘 하드리셋에서 정털려서 접엇다가 5월2일날 복귀햇습니다  지금 키우는거  인파 ( 시즌1때 본캐여서 손에편해서 지금도 주력으로하는중) 블래스터 (마찬가지로 시즌1때 부캐로 모든게 냄새나지만 전 너무 좋아하는 애) 슬레이어(이번에복귀해서 새로 만든직업 처단자인데 폭주상태때 딜모는게 재밋음) 블레이드 ( 이번에 새로 만든캐릭 몬가 스타일리쉬한데 몬가 좀 약한느낌임) 브레이커 (권왕인데 그냥 타격감고트임 가끔 투지수급안되서 손가락빨고잇을때 답답함) 창술사 ( 시즌1 3번째부캐엿던친구 딜사이클단조로운데 강햇던걸로 기억하는ㄴ데 지금도 바뀐거1도없이 똑같아서 놀람)   일단 이렇게 6캐릭하고잇는데요  얘들숙제다하고 천천히 하나정도 더 키워보려고하는데  일단 백어택딜러를 많이햇다보니 백어택딜러도 괜찮고 블래스터처럼 포지셔닝 자유로운 타대딜러도 좋습니다 헤드만 아니면 될거같고  지속딜링보단 한방캐릭을 선호하는 편입니다.  지금키우는애들이랑 유각도 좀 많이 겹치는 캐릭으로.. 하나만 추천부탁드릴게오,선생님들_모코코_직_1.jpg,유각,65200605; 65201505; 65203105; 65203905; 65200805; 65203305; 65204105; 65201005; 65203705; 65203505; 65202805; 65200505; 65203005
200만골있는데 유각vs 보석,https://www.inven.co.kr/board/lostark/6271/2044244, 킹너굴맨,2025-05-26 13:59,갑자기 상상악세 떠서 팔아서 목돈이 생겼는데   둘중뭐살까..  유각은 사면 예둔읽을거임.,,유각,65200605; 65201505; 65203105; 65203905; 65200805; 65203305; 65204105; 65201005; 65203705; 65203505; 65202805; 65200505; 65203005
시즌3오면서 손조금씩 봤으면 좀더 나았을텐데,https://www.inven.co.kr/board/lostark/6271/2044252, 럭키박스,2025-05-26 13:59,보석도 그렇고 유각도 포인트화시켜서 본인이 보유한 유각포인트를 자유롭게 분배할수있게 했으면 추가적인 패치있을때 후폭풍이 덜했을거같은데... 특히 유가은 아쉬운게 확률도파민 챙기려면 읽었을때 확률적으로 실패/+1/+2이렇게 넣어주거나 지금강화처럼 유물각인서 넣어서 경험치채우고 시도해서 실패/성공넣어주거나.. 뭐그랬으면 어땠을까 싶은데... 지금은 유각마다 가격편차도 크니까 후속패치를 내버리면 반발이 거셀수밖에 없을거같음  뭐 이유가있겠지만은 아쉬움,,유각,65200605; 65201505; 65203105; 65203905; 65200805; 65203305; 65204105; 65201005; 65203705; 65203505; 65202805; 65200505; 65203005
그냥 승리의 노말단으로 살아야겠다,https://www.inven.co.kr/board/lostark/6271/2044175, 맏춤뻡고수,2025-05-26 13:48,뭔 유각이냐 돈도 없는데 노노유각단하고 승리의 노말단 해야겠다,,유각,65200605; 65201505; 65203105; 65203905; 65200805; 65203305; 65204105; 65201005; 65203705; 65203505; 65202805; 65200505; 65203005
만약 521% 쌀거래로 삭제된 만큼 다들 유각 읽었으면,https://www.inven.co.kr/board/lostark/6271/2044174, 쌍독수리,2025-05-26 13:48,유각시세 정상화 됐을까? 근데 쌀 산 사람중에서도 유각읽을 사람은 또 읽으니 이 가격대가 그냥 유지됐으려나,,유각,65200605; 65201505; 65203105; 65203905; 65200805; 65203305; 65204105; 65201005; 65203705; 65203505; 65202805; 65200505; 65203005
로아의 본질적인 문제는 재미가 없다 변화가 없다,https://www.inven.co.kr/board/lostark/6271/2044172, 로끼끼,2025-05-26 13:47,"전재학이 매달 라방켰던 이유.  게임이 급속도로 망해가던 이유는 순수하게 게임이 노잼이라 그래  경제니 나이스단이니 유각이니 이건 부차적인 문제라고  근데 몇주동안 나이스단이니 유각이니 가지고 싸우는거보면   그냥 자기 밥그릇뺏기기싫은 똥개일뿐  나이스단패면서 유각수호하면서 게임위한거라고 위선좀 떨지마    진짜 게임을 위하면  너희가 희생해서 보석유각은 값싼 요소로 하고 다른방식의 스펙업을 내는게맞아  그리고 지금부터라도 준비해서   시즌4부턴 진짜 ""시즌제""답게 운영하는것  그것밖에 없어  시즌3는 진짜 간판만 바꿨고  ""변화""가 없다고 똑같은걸 5년째 하고있는데 안질릴수가있어?  이미 한번 안갈아엎으면 답없는 수준까지 와버렸는데 니들 밥그릇챙기는게 그렇게 중요해?  아니 정확히 말하면 시즌3때 이미 갈아엎으면서 시작을했어야 했음 게임구조든 내실이든 성장이든  전투분석기나온다고 갑자기 몇달동안 돌던 레이드가 재밌어질거같아? 처음 몇주는 그렇겠지   게임의 본질은 재미야  로아는 재미가 없어.  로아는 변화가 없어.   누군가 희생을 할 시기가 온거야.",로아의_본질적인_문_1.jpg,유각,65200605; 65201505; 65203105; 65203905; 65200805; 65203305; 65204105; 65201005; 65203705; 65203505; 65202805; 65200505; 65203005
난 유각 가격대 비싼건 별로 불만 없는데,https://www.inven.co.kr/board/lostark/6271/2044165, 곰라빛,2025-05-26 13:47,누군 싼 유각 세네개 껴서 쉽게 스펙업하고  누군 비싼 유각으로만 5개 꽉꽉채워써야하는 시스템이 싫음  특정 메이저 각인들은 대부분의 직업이 쓰니까 수요도 많은데 드랍률도 더 낮아서 가격 엄청 올라가고  마이너 각인들은 1주일 숙제 하고나면 걍 20장 읽어버리는데  일부 직업들은 선택지 없이 메이저만 쓰니까 다른 직업에 비해 유각값 두어배는 나가는 상황도 나오는데  스펙업은 똑같이 되고  이 시스템이 맞나싶어,,유각,65200605; 65201505; 65203105; 65203905; 65200805; 65203305; 65204105; 65201005; 65203705; 65203505; 65202805; 65200505; 65203005
보석가루팔이+버스하던 지인은 무과금으로 유각 다 읽긴 함,https://www.inven.co.kr/board/lostark/6271/2044152, 에리하,2025-05-26 13:44,하기르때 가루팔이 달달했다던데,,유각,65200605; 65201505; 65203105; 65203905; 65200805; 65203305; 65204105; 65201005; 65203705; 65203505; 65202805; 65200505; 65203005
소신발언) 유각은 지금 가격을 종막전까지 유지하는게 맞다고봄,https://www.inven.co.kr/board/lostark/6271/2044142, 서폿콜라곰,2025-05-26 13:43,어차피 유각은 엔드스펙업 개념이고 나올때부터 최종 스펙업 요소처럼 나온거기때문에 이걸 지금 단계에서 굳이 완화 or 개선해서 가격을 낮출 필요는 전혀 없다고 생각함  만약 가격이 싸져서 각인스펙업의 효율이 제련 스펙업의 효율을 앞질러버리면 각인은 원정대화라서 범용성이 훨씬 넓기때문에 사람들이 각인만 올려서 레이드에서는 방어구 제련이 안된 상태로 스펙통과받고 추풍낙엽으로 쓰러지는 광경을 볼 수도 있음  반박받음ㅇㅇ,소신발언)_유각은_1.png,유각,65200605; 65201505; 65203105; 65203905; 65200805; 65203305; 65204105; 65201005; 65203705; 65203505; 65202805; 65200505; 65203005
보석은 떨어지는데 유각은 오르는건 이걸로 이해가능함,https://www.inven.co.kr/board/lostark/6271/2044147, 연하나,2025-05-26 13:43,보석은 접으면 시장에 대량으로 풀리는데 유각은 그게 안됨 만약 유각도 빼다 팔 수 있었으면 지금 가격의 1/3토막 났을걸  삭제가 되고 안되고 차이가 큼 특히나 지금처럼 대거로 접고 떠나는 상황이면,,유각,65200605; 65201505; 65203105; 65203905; 65200805; 65203305; 65204105; 65201005; 65203705; 65203505; 65202805; 65200505; 65203005
지금 문제들이 터지는 이유는 게임이 재미없어서임,https://www.inven.co.kr/board/lostark/6271/2044140, 서풋미드,2025-05-26 13:42,반복된 노동으로 게임이 재미없어지니까 문제들이 하나 둘 터지기 시작한거지 지금도 게임이 재미있는 사람은 아무리 비싸도 보석사고 유각 읽고있음,,유각,65200605; 65201505; 65203105; 65203905; 65200805; 65203305; 65204105; 65201005; 65203705; 65203505; 65202805; 65200505; 65203005
나 진짜 마효증 기상 말로만 그러는줄 알았는데,https://www.inven.co.kr/board/lostark/6271/2044115, Nemuibazzi,2025-05-26 13:39,마효증 유각 찍고 신청하는 기상 있긴 하더라 사이드 노드 전부 찍었으면 받았는데,,유각,65200605; 65201505; 65203105; 65203905; 65200805; 65203305; 65204105; 65201005; 65203705; 65203505; 65202805; 65200505; 65203005
나 어제 돌대유각먹었다!,https://www.inven.co.kr/board/lostark/6271/2044119, Shes,2025-05-26 13:39,오예오예~~,,유각,65200605; 65201505; 65203105; 65203905; 65200805; 65203305; 65204105; 65201005; 65203705; 65203505; 65202805; 65200505; 65203005
근데 보석값은 저렇게 떨어지는데 유각은 왜?,https://www.inven.co.kr/board/lostark/6271/2044110, 하면된다구요,2025-05-26 13:38,왜케 배우는거야 같이떨어져야 정상아니야   유각 왜배우는데 게임도쉬워졌는데ㅋㅋ,,유각,65200605; 65201505; 65203105; 65203905; 65200805; 65203305; 65204105; 65201005; 65203705; 65203505; 65202805; 65200505; 65203005
죽이고 싶은건 쌀숭이였지,https://www.inven.co.kr/board/lostark/6271/2044093, 디셈버,2025-05-26 13:35,유각을 시즌 초기부터 3패키지에 1장 이라도 읽어준 진짜 고객은 아니였나봄  쌀값하락으로 쌀숭이 많이 쳐냈고  이제 유각존버단중에 기회줄때 올라탄애들로 앞으로의 고객 걸렀으니  그 아랫구간 무과금 유저들 때릴듯;;  귀속골드 어케 들어올지 몰라도  이걸로 나이스단 전멸 시키고 부캐만 살아남게 바꿀거 같음,,유각,65200605; 65201505; 65203105; 65203905; 65200805; 65203305; 65204105; 65201005; 65203705; 65203505; 65202805; 65200505; 65203005
원한유각을 판다vs묵혔다 판다 +투표,https://www.inven.co.kr/board/lostark/6271/2044092, 하얀백설기,2025-05-26 13:35,지금당장판다 vs 묵혔다판다  + 투표,원한유각을_판다vs_1.jpg,유각,65200605; 65201505; 65203105; 65203905; 65200805; 65203305; 65204105; 65201005; 65203705; 65203505; 65202805; 65200505; 65203005
유각이 비싸면 뉴비한테 오히려 좋다고?,https://www.inven.co.kr/board/lostark/6271/2044080, 드비안느,2025-05-26 13:33,"뉴비 유입 시 직면하는 실질적인 문제 정리  1. ""1700~1720 구간은 유각이 없어도 된다""는 주장에 대한 반박 해당 주장은 숙련 유저 기준의 이야기일 뿐이다. 숙련자는 부족한 세팅도 패턴 이해도와 조작으로 커버가 가능하다. 그러나 뉴비는 카드, 초월, 추피, 엘릭서, 상재 등 게임 시스템조차 제대로 알기 어렵다. 이들이 메이저 유각 없이 숙련 콘텐츠에 참여해 기여하는 것은 현실적으로 불가능하다.  2. 유각(유물 각인서) 비용의 현실 메이저 유각 평균 12.5만 골드 × 100장 = 총 1,250만 골드 필요 10만 골드당 2만 원 기준, 약 250만 원에 해당 이 비용은 각인서만 기준이며, 보석, 초월 , 엘릭서,카드, 추피, 재련 등은 별도 뉴비가 이 구조를 인지하고 진입하기란 매우 어렵다  3. 이벤트 완화 아이템조차 환영받지 못함 예: 8레벨 보석 이벤트 제공 시 기존 유저는 “나는 현금 또는 시간을 들여 맞췄는데, 뉴비는 공짜로 받네?” 이런 박탈감은 거부감으로 이어지며, 결과적으로 유입된 뉴비조차 파티에서 외면당함 스펙이 부족한 뉴비는 완화빔을 받더라도 시스템상 참여 자체가 어렵다  4. 시스템 구조의 맹점 원정대 정보로 뉴비인지 숙련자인지 즉시 파악 가능 스펙 검증 없이 파티 참여가 불가능한 구조 결국 뉴비는 게임을 설치해도 실질적인 콘텐츠에 참여하지 못함   유각 가격 상승의 실질적 수혜자는 누구인가? 유각 가격이 높을수록 오히려 기존 유저에게 유리하다. 이미 유각을 다 읽은 유저는 더 이상 비용 부담이 없고, 비싼 유각을 판매해 골드를 벌 수 있으며, 이 골드를 현금화까지 할 수 있다. 반면 뉴비는 진입장벽에 막혀 캐릭터 성장조차 어려운 상황에 처하게 된다. 결국 ""유각이 비싸서 좋다""는 주장은 뉴비를 위한 것이 아닌, 기존 유저의 자산 가치를 지키려는 자기합리화일 가능성이 크며, 게임의 신규 유입을 가로막는 주요 원인 중 하나다.   결론  기존유저들의 배려가 없다면 더 이상 로아에 유입+잔존율은 더더욱 떨어질거라 보이며  건강한 게임문화와 북적이는 MMORPG에서의 재미를 추구하는 유저들은  본인의 손해를 감내하며, 게임의 활성화가 모두가 사는길이라 생각하고,  뉴비 유입을 위해 적정선의 완화+구조 사다리를 통해 그들의 생존을 응원하겠지만   현재 상황에서 쌀숭이들에게는 뉴비를 위한 완화는 지속적인 골드+보석값 하락으로 인해  생사가 갈리는 환경이기때문에 그들은 매우 예민하게 반응하며 커뮤니티에서 반발할것으로 보임",,유각,65200605; 65201505; 65203105; 65203905; 65200805; 65203305; 65204105; 65201005; 65203705; 65203505; 65202805; 65200505; 65203005
강습 개발할시간에 카제나 빨리 쳐내지,https://www.inven.co.kr/board/lostark/6271/2044068, 므젤,2025-05-26 13:32,어차피 철회 치트 쓸거였으면 강습 만들시간에 카제나 빨리내지 쓰잘데기 없는데 개발인력 낭비하네  강습 나와서 유각이랑 골드 풀어봐야 이래도 욕쳐먹고 저래도 욕쳐먹으면 그냥 이런 단발성 쓰레기 만들지말고 메인컨텐츠나 집중해라ㅇㅇ,강습_개발할시간에_1.gif,유각,65200605; 65201505; 65203105; 65203905; 65200805; 65203305; 65204105; 65201005; 65203705; 65203505; 65202805; 65200505; 65203005
로접하고 자게보니 희극이네,https://www.inven.co.kr/board/lostark/6271/2044071, 높은산트롤,2025-05-26 13:32,똥 싸지른건 겜사인데 유저끼리 하루종인 밥그릇 쌈하는거보니 유저수준이 진심 폐급란걸 느낌.  하긴 8겁작 11개도 못사서 게임미래 팔아버리게 하고 디렉터는 공황으로 즙짜게 만드는 수준인데 ㅋㅋ  하드리셋당할 때까지 유각이니 보석이니 감가니 많이들 싸워라. 이미지 ㅈ박아서 유입도 없을텐데 하드리셋 한달 뒤 여름 로아온 때 발표할지도ㅋㅋ,,유각,65200605; 65201505; 65203105; 65203905; 65200805; 65203305; 65204105; 65201005; 65203705; 65203505; 65202805; 65200505; 65203005
알아버렸다...,https://www.inven.co.kr/board/lostark/6271/2044066, 김결백,2025-05-26 13:31,"유각이 비싸다고 심술 부려서, 가격 내려줬더니  이미 읽은 사람 뭐가 되냐고 심술부리고   유각 가격 정상화되니까  이번에는 또 비싸다고 난리나고...   그냥 사람들은 외로웠던게 아닐까?  서로 시비를 가리며 대화를 하고 싶었던게 아닐까..?",,유각,65200605; 65201505; 65203105; 65203905; 65200805; 65203305; 65204105; 65201005; 65203705; 65203505; 65202805; 65200505; 65203005
이렇게만해주면 해피로아가능?,https://www.inven.co.kr/board/lostark/6271/2044053, 왕의품격,2025-05-26 13:30,보석 원정대화 겁작변환가능   팔찌 치특신 변화가능  어빌스톤 포인트화 각인효과 상관없이 범용사용가능하게  유각 포인트화 20포채우면 아무거나 각인 선택가능  또 모있음? 적어주셈  변환하는데 필요한 재화는 개발진이 알아서..,,유각,65200605; 65201505; 65203105; 65203905; 65200805; 65203305; 65204105; 65201005; 65203705; 65203505; 65202805; 65200505; 65203005
로아 줫병신 게임,https://www.inven.co.kr/board/lostark/6271/2044049, 세류소서,2025-05-26 13:29,"라방켜서 고작 한다는게  지들이 잘못해놓고 겜사는 손해 1도 안보고 ㅈㅅㅈㅅ  유저가 손해봐라 그냥 사과는 해줄께  광휘 롤백 합니다  일반 유저는 알빠x  이게 뭔짓거리냐 대체  돈벌어 쳐먹을려고 유각 끼워 팔기, 재료 패키지 쳐팔기  보너스룸 블루크리스탈로 사면 쌉니다?  개짜치는 라방에서 우는 전재학 같은 억지 카드 팔아재끼는건  입꾹닫...  선택적 사과 ㅅㅂ 보는 내내 개열받더라  유저들 손해본거 수습이 아니고  아 몰라 미안 끝  이게 정상적인 기업이 할짓거리임?",,유각,65200605; 65201505; 65203105; 65203905; 65200805; 65203305; 65204105; 65201005; 65203705; 65203505; 65202805; 65200505; 65203005
30추에 올라온 기상 진짜 존나웃기네 ㅋㅋㅋㅋ,https://www.inven.co.kr/board/lostark/6271/2043995, 맛있는거주세,2025-05-26 13:21,무슨 17층이 딜찍 해주러 온줄 알았는데  유각 10장 읽은 무기 17강이 딜밀어준다고 꺼드럭거린거였네 ㅋㅋㅋㅋㅋㅋㅋㅋㅋㅋㅋㅋ,,유각,65200605; 65201505; 65203105; 65203905; 65200805; 65203305; 65204105; 65201005; 65203705; 65203505; 65202805; 65200505; 65203005
근데 로아 강습이라도 있어서 지금이 나은거임ㅇㅇ,https://www.inven.co.kr/board/lostark/6271/2043963, 통장님,2025-05-26 13:16,지금 제 아무리 유각 개고기 냉장고 보석 감가 77퍼 80퍼 개떡락 ㅇㅈㄹ 해도 냉정하게 생각하면 솔직히 주에 깐부랑 강습노말&하드 갈때는 기대되긴함  ㄹㅇ '이번주는 고대가 뜨겟지..!' 하는  기대 되는 마음이 조금이라도 있긴한거지  근데 6월에 강습끝나고 로아온 하는데 막말로 카제로스가 로아온하고 '다음주' 이거 안하는 이상 그 사이가 ㅈㄴ 고난의 행군에+쌀값 나락 피크이지 않을까  아 로아온 '다음주'에 여홀나 바로 출시한다면 좀 다를수도..?,근데_로아_강습이라_1.jpg,유각,65200605; 65201505; 65203105; 65203905; 65200805; 65203305; 65204105; 65201005; 65203705; 65203505; 65202805; 65200505; 65203005
유각 업뎃 이후 계정5개 원한아드 못먹어봄,https://www.inven.co.kr/board/lostark/6271/2043957, 뚜아아아앙,2025-05-26 13:14,1640 3계정 1700 부계1개 1720+ 6캐 본계 돌대2 저받2 예둔1 먹어본게 끝임 카게필보 레이드 카던가토 휴게안쌓고 빠진적없음 진짜 존나 안나오긴 한다 잡유각은 개많이쳐먹음,,유각,65200605; 65201505; 65203105; 65203905; 65200805; 65203305; 65204105; 65201005; 65203705; 65203505; 65202805; 65200505; 65203005
유각 더 올라야하면 개추ㅋㅋ,https://www.inven.co.kr/board/lostark/6271/2043950, 각진,2025-05-26 13:13,난 다샀음 일딴,,유각,65200605; 65201505; 65203105; 65203905; 65200805; 65203305; 65204105; 65201005; 65203705; 65203505; 65202805; 65200505; 65203005
게임을 게임으로 못보고 주식처럼 하는 사람이 많네,https://www.inven.co.kr/board/lostark/6271/2043942, 게시글쓰기,2025-05-26 13:12,"애초에 액수가 부담되면 안지르면 되는데 왜 지들이 질러놓고 감가에 그렇게 목메는 거임  당장 -던- 만해도 고증은 취향의 영역이고 그외 스팩업은 2년마다 쳐 리셋함 지금 수백-수천하는 장비도 1년반뒤면 가치 0원됨.  그게 시즌제 게임이고 요즘 rpg임 특히 파티,레이드 게임은 유저 유치+유입을 위해 다 이렇게 함.  상식적으로 유입들이 최종 컨텐츠 하나 즐기겠다고 수백 주면서 할거 같음?  결국 비싼겜은 유입이 없고(쌀먹 제외) 서서히 말라가는건데 파티레이드 겜은 유저수=겜흥망이고, 이건 꼬라박는 수치가 지수함수 그래프 마냥 뒤로 갈수록 커져서, 첨엔 잘몰라도 갈수록 사태의 심각성이 보이는거임  이걸 2022년부터 말했는데, 로아하던 애들은 최종컨텐츠 가려면 500은 당연히 써야지 700은 당연히 써야지 1000은 써야지 개나 소나 최종컨텐츠하는 게 말이됨? 돈을 쓰든 시간을 쓰는 해. 이 지랄 하고 있으니 겜이 제대로 돌아가겠나?  물론 지금 가감은 너무 급진적이라 기존 유저들 입장에선 반감 있을 수 있음 근데 그래서? 안하면 뭐 어쩔건데? 다른 대안이 있음? 아니 다르게 말해서 현 파티 레이드 겜에서 너희가 원하는 만큼 템가치 유지시켜주는 게임이 있음?  유저 대다수가 맞춘 장비는 결국 필수에 가까워질수 밖에없고 이건 가감 조져서 신규유저도 쉽게 맞출수있게 할 수 밖에 없음  물론 에스더나 유각 같은 경우는 좀 상황이 다를듯  결국 던전 완화로 커버가되는 부분이있고 아닌부분이있는데 내가 그래서    리셋 하고 다같이 새로 시작한 후, 정기적 리셋 일자 예고 하는 편이 더 나을 지도 모른다고 하는거임 그러면 아이템 가격이 적어도 지금보단 낮게 잡힐 테니까.  결론은 너희가 원하는 대로 템가치 유지시키면 그건 그것대로 게임 쳐망함 신규/복귀 받으려면 결국 겜은 싸게가는 수밖에 없음. 큰돈은 큰손들에게만 받고  게임 접을거다 뭐다하는데, 어느 겜가든 가치유지 시켜주는 겜 없음(파티 레이드 rpg겜에선) 지금까지 로아가 비정상적인거였을뿐  게임 문화도 병신같은거 존나 많은데 여기에 쓸 내용은 아니라 난 패스함  게임시스템도 문젠데, 유저도 문제 존나많음. 왜 겜에 수백써서 최종컨텐츠 하는거에 자부심을 쳐 느끼는지 이해X. 그게 게임 망하는 길이란걸 진지하게 몰랐던건가",게임을_게임으로_못_1.jpg,유각,65200605; 65201505; 65203105; 65203905; 65200805; 65203305; 65204105; 65201005; 65203705; 65203505; 65202805; 65200505; 65203005
쌀숭이쉑들 유각 완화는 절대없다,https://www.inven.co.kr/board/lostark/6271/2043937, 므젤,2025-05-26 13:11,외부 거래 판매골드는 매크로랑 작업장이 다팔았냐 팔거 다팔았으면 걍 없는채로 살아라 유각 읽을대로 읽은 애들은 보석사고있지 뭔 유각 완화여,쌀숭이쉑들_유각_완_1.png,유각,65200605; 65201505; 65203105; 65203905; 65200805; 65203305; 65204105; 65201005; 65203705; 65203505; 65202805; 65200505; 65203005
골두꺼비로 유각할인할때 사지,https://www.inven.co.kr/board/lostark/6271/2043930, Silyung,2025-05-26 13:09,왜 연장기대컨하다 연장안해서 오르니까 비싸다고 징징거리냐 3주동안 최대 반값가까이 박살내놨었는데 심지어 골두꺼비내기전보다 아직도 싸다 심리자체가 게임이 안망했고 살아났다는 전제로 아드 5만골한다해도 차피 안읽을게 뻔함,,유각,65200605; 65201505; 65203105; 65203905; 65200805; 65203305; 65204105; 65201005; 65203705; 65203505; 65202805; 65200505; 65203005
