title,url,author,date,text,images,keyword,item_index
지금 보석 저점이라고 말해도 소용없음,https://www.inven.co.kr/board/lostark/6271/2047477, 약간아르고스,2025-05-26 23:39,골두꺼비때 유각 저점이라고 할때도 안사던 사람들이 살리가 없음  이제 로아온전에 좀 오르고 어차피 로아온+여름업뎃때 8겁작 ㅈㄴ풀리니까  한참 떨어지겠지 하면서 입 쩍 벌리고 있는게 한트럭임  통수맞고 보석값 하락폭 적은거보고 스마게 욕할게 눈에 선함,지금_보석_저점이라_1.gif,유각,65200605; 65201505; 65203105; 65203905; 65200805; 65203305; 65204105; 65201005; 65203705; 65203505; 65202805; 65200505; 65203005
참고로 보석은 지금이 저점이다,https://www.inven.co.kr/board/lostark/6271/2047448, 유유유,2025-05-26 23:33,이글을 본다면 보석살준비를 하셈   저기보면 철포 8작->9작 효율 보면 주력기 9작효율이 1점당 22500골임고 저받유각효율이 1점당 70500골이라  나이스캐릭2개면 효율좋은 6캐릭 돌려쓰는 유각보다 더좋다는 거임 참고로 인파의 주력기는 딜비중이 낮음  방어구상재 10~20 수준 무기는 21강정도가 대충 25000골  무기21강 후에 해야할 스펙업이 주력기 8작->9작 수준이 현상황임  포셔의 보이는 손으로 9작효율 좋습니다 ㅇㅈㄹ 하면 바로 거기서 오르는거임    적고보니 작열이였네? 참고하셈 겁화는 43000골임,참고로_보석은_지금_1.png,유각,65200605; 65201505; 65203105; 65203905; 65200805; 65203305; 65204105; 65201005; 65203705; 65203505; 65202805; 65200505; 65203005
장문 주의) 보석 문제 포함 현 로아 경제 문제 해결 방법,https://www.inven.co.kr/board/lostark/6271/2047354, a01b01c01,2025-05-26 23:05,"들어가기에 앞서  내 말이 단 하나의 정답이라는 게 아니라  방법을 생각하는 과정에서 내가 괜찮아 보이는 거 적은 거니  비방보다는 자유로운 토론이 되었으면 좋겠고 분탕은 병먹금하고  내 생각이 옳아서라기보다 많은 사람들이 보고 토론이 이뤄질 수 있도록 추천 좀 줘서 올려줬으면 좋겠음  보석 관련 스마게의 발언과 현상황 분석  전재학의 관련 발언을 생각해보면 성장을 위한 비용 부담 완화를 해주겠다 라는 발언이 있었음  이걸 근거로 어차피 보석의 감가는 필연이며 폭락은 받아들여야 한다는 의견들이 있는데 난 생각이 좀 다름  자연스러운 보석의 감가는 당연히 맞지만 지금은 부자연스러운 시장 개입으로  폭락한 상황인데 이걸 유저가 다 맞으라는 건 맞지 않고 최소한 스마게도 같은 생각을 가지고 있다고 생각함 (라방마다 자살골을 차는 건 별개로 선의가 있다고 믿어본다면 말이지)  걍 뇌피셜? 추측의 근거  성장 부담 완화라고 하면 결국 주요 스펙업 요소 필요 재화 너프인데 주요 스펙업 요소는 보석 유각 재련, 그외 레이드 부산물(엘릭서, 초월, 상재 등등)  각 스펙업 요소에 대해서 어떻게 접근하려 했는지  라방에서의 발언을 다시 따져보자  보석이 중요한 자산이니 가치 보존을 해주겠다 (적절한 자극을 주어 경제 살리겠다) 유각값은 우리 예상보다 값이 낮아져서 골두꺼비 연장 안 한다  이 발언들을 따라가면 결국 보석은 유지하고 (자연스러운 우하향이야 인정이지만  지금 같은 급락은 해결하겠다는 이야기) 유각은 안 떨구겠다는 건데  그러면 남은 건 재련 완화가 됨 이건 아래 적은 귀속 골드로 해결하려는 것이니 일단 보석 이야기를 더해보자.  보석 가치 보존 필요성  왜 전재학은 다른 스펙업 요소도 많은데 보석에 대해서 가치 보존 이야기를 했을까? (라방 할 때마다 말아먹고 개 같이 폭락시킨 건  일단 넘어가고 발언 의도를 한 번 생각해보자)  보석은 다른 스펙업 요소와  결정적으로 다른 한 가지가 있다. 바로 거래 가능 재화라는 것.  이것은 본부케를 바꾸거나 급한 골드 필요 OR 접어서 현금화가 가능하다는 것으로  다른 케릭터에 귀속되는 여타 스펙업 요소들과 구분되는 보석만의 특징이다.   이러한 특징을 유저도 알고 디자인한 스마게도 알고 그렇게 투자를 해왔던 걸 알기에 다른 스펙업 요소보다  보석 가치를 지켜주겠다고 하는 것.  그럼 니가 생각한 해결책이 뭐냐?  현재 상황으로는 광휘가 들어올 뿐 무엇도 해결이 안 됨 원정대화 이야기도 나오지만 원정대화는 유저가 불편만 할 뿐 얻는 게 없음 (세팅의 자유화? 이미 겁작 가지런히 다 맞춰놨는데 무슨 세팅을 갈아엎어? 알빠노 담 시즌에 보석 없애 걍) 그러니 역발상으로 광휘+을 만드는 거임!  광휘 두 개를 합치면 이전에 말했던 광휘 공증 혹은 조금 더 높은 효율인 광휘+을 적용  이전에 나이스단의 불만은 어차피 고스펙에 가면 광휘가 강제 되니까  상대적 차별을 받으니 문제라는 거였는데 같은 비용을 들인 보석인 일반 광휘는 스펙 차이가 없고 광휘+은 2배로 비용을 들인 보석이니 쎄게 해도 문제 없잖아? 아니면 나이스단도 3개를 합쳐서 1단계 위인 보석을 맞추면 되는 거고  사실 세부 수치는 중요하지 않음 중요한 건 1보석과 3보석 사이에 걸맞는 적당한 스펙업인 2보석 광휘+을 넣는 것  당연히 15일 단위로 거래 가능 보석으로 변환도 가능해야지  이건 비나이스나 사장님들 통나무 들라는 거 아냐?  단순히 시스템이 들어온다고 해도 이득이 없으면 어차피 아무도 쓰지 않을 거임  근데 놀랍게도! 취소된 공증 효과를 그대로 가져와 쓴다고 해도  8광휘+부터는 23강 이상 무기 강화보다 골드 효율이 좋음  비슷한 효율이기만 해도  당연히 우선순위는 재련보다 보석이 됨 왜냐? 보석은 나중에 뺄 수가 있잖아  사장님들 에스더 엘라 엘라꼴 나는 거 아니냐고?  노노노! 놀랍게도 사장님들 팔찌나 품질이나 돌 깎기는 천장이 없는 미친 확률 미친 소비인데 보석은 나중에 회수도 되는 확정 스펙업임  이걸 통해서 얻을 수 있는 효과?  비나이스는 본케를 더 투자할 때 나중에 회수 가능 형태로 스펙업을 선택할 수 있음  레이드적으로는  레이드 하지 않아도 되는 스펙업 요소가 추가되기 때문에 더더욱 딜찍이 가능해져서 레이드가 쾌적해짐  시장적으로는 케릭터에 홀드 되는 보석수가 더 많아짐 =보석 값이 오르게 됨  보석값이 오르면 뉴비 다 죽네~ 는 케릭 귀속이니 원정대화보다 훨 낫고 애초에 아래 귀속 골드 정책에 따로 적어둔 방법으로 보완 가능함  ------------------------------ 작업장 척결을 위한 귀속 골드 정책 아이디어  골드 폭락은 어디서부터 시작되었나  여러 가지 있겠지만 내 생각엔 지금도 골드를 뽑아내고 있을 1640 다계정단  + 작업장들임  거기에 다른 이유로 요즘 엉망진창 짓으로 꼬접한 사람들 매물 + 스마게의 시장 직접 개입으로 얼어붙은 소비 심리  요런 건 어차피 바로는 해결이 불가능하니 넘어가고  위에 말한 작업장 등에 대한 해결책으로  이번에 스마게가 제시한 건 귀속 골드임  이 귀속 골드 정책은  뉴비와 작업장이 섞여있는 구간에 대한 이야기라 뉴비는 건지면서 작업장들은 거르는 거름망으로 동작해야 함  현재 작업장들은 레이드 골드만 문제가 아니라 에포나 골드 + 생활 + 카던 보석 판매가 주력인 걸로 알고 있음  해당 내용은 특정 레벨 달성 전까지 해당 캐릭터가 얻는 골드를 모두 배율을 높여서  귀속 골드로 받게 만들면 해결됨  원정대에 적어도 본캐 하나는 있어야  거래 가능 골드를 캘 수 있게 해서 무지성 주차 다계정 작업장들을 박멸할 수 있고 뉴비는 높은 배율로 귀속 골드를 퍼줘서 재련 비용을 충당해서 빠르게 성장할 수 있으니 오히려 좋음  뉴비 보석 문제에 대한 해결법  지금 뉴비의 폐사 구간은 다른 부분보다 이벤트 보석이 적용되지 못 하는 더 상위 보석을 맞춰야 되는 곳임  여태는 버는 골드로  재련과 레이드 보상 스펙업 요소 소모를 충당했는데 갑자기 고가의 보석을 맞추라고 하면  더 위로 올라갈 수가 없게 되고 주차는 재미가 없기 때문에  반복하다가 게임을 접게 됨  그걸 귀속 골드 상점에서  기존 이벤트 보석을 업글권을 몇 개 수량 제한 걸어서 팔면 됨  그러면 뉴비는 상위 보석을 맞추는 비용을 완화 받을 수 있고 귀속 골드도 뉴비가 나름 레이드 등 활동을 하여 벌어들인 골드가 소모된 것이기 때문에 무지성 지급보다 훨씬 양산을 막는 바람직한 형태가 됨  귀속 골드 상점 필요성  귀속 골드 상점이 따로 들어와야 하는 이유는 현재 상태에서 귀속 골드가 극단적으로 들어오게 되면 천천히 영지 꾸미고 레이드 천천히 하는 유저를  작업장과 구분 짓지 못 하고 불태우게 된다는 건데 이런 유저들을 지켜줄 수 있는 게 바로 귀속 골드 상점임  이런 시스템이 적용되고 효과를 잘 내서 작업장들이 박멸되면 어떻게 될까?  보석 생산량 감소,  수집품 가격 상승, 생활 재료 가격 상승 이 예상됨  재련 재료는 생산량 감소로 상승할지 어떻게든 살겠다는 발악으로 본케 하나 만드느라   상승 잠깐 하고 다시 나락 갈지 모르겠음  이중 다른 건 상관 없지만 (오히려 보석 생산량 감소로 가격 증가는 좋음) 생활 물품 가격 상승이 타격이 큰 부분이 있는데  이건 바로 영지 만찬 뿌리는 분들임  이런 유저들은 당연히 자기 이득을 위해 진행하지도 않고 대다수가 자체 수급으로 모자라서 경매장을 이용하는데  작업장이 전멸하면 낚시부터 생산량이 급감함  이에 대한 대책으로 최소한 귀속 골드로 귀속 생활 재료들을  저렴하게 제공할 필요가 있음  이를 통해 잘 되면 뉴비가 만찬 차려서 사람들 대접하는  새로운 좋은(?) 문화가 생겨날 수도...  -------------------  너무 길어서 3줄 요약은 힘든데 암튼 장문 써서 미안하니 최대한 요약해봄  보석은 회수 가능 재화니까 이점을 활용해서 비나이스에게 추가 스펙업 기회를 제공하자 보석 감가 나이스단은 덜 맞고 있다고 하는데 어차피 지금 다 같이 맞고 있는 상황이고 뉴비 살리기 운운하기 전에 우리부터 죽게 생겼다! 뉴비 살릴 방법은 스마게가 생각해야지! 일단 우리부터 살고 보자 좀! 거렙님이 있어야 뉴비를 끌어주지  -------------------------- 갈드컵 열릴 글도 아니라고 생각하지만 혹시나 출신 가지고 갈드컵 열릴까봐 미리 말하면 4딜 2폿에 아르데 데모닉 슈샤 요즈 애니츠 실린 임... 부케는 1725 바드입니당..",,유각,65200605; 65201505; 65203105; 65203905; 65200805; 65203305; 65204105; 65201005; 65203705; 65203505; 65202805; 65200505; 65203005
유각입찰먹튀 렌라쿠 박제합니다,https://www.inven.co.kr/board/lostark/5355/230296, 미술관에서,2025-05-26 23:05,"■ 작성 목적   [제보, 해명, 사과 중 선택] 노말 아브렐슈드 2막 버스 진행 중 유각미참 방에서 유각 입찰 후 도주   ■ 게임 닉네임 ※ 작성자 계정 스크린샷 미첨부 시 삭제 될 수 있습니다   작성자: 밍슥봉   대상자: 렌라쿠 / 보리로그리는그림 / 갈치보단명치 / 깅여울 / 우비다 / 총쭈     ■ 사건 설명   * 발생 날짜  : 2025 05 26 오후 10시 50분경   * 사건 내용  : 노말 아브렐슈드 2막 버스 종료 후 입찰 진행 중 유각 미참 방인데도 불구하고 유각미참   ■ 증거 자료(스크린샷, 동영상)     ■ 요약 내용  어디서 계정 주워와서 버스타고 유각 나오면 버스비 회수하려고 이러는거같은데 그러지 맙시다 ~",유각입찰먹튀_렌라쿠_1.png; 유각입찰먹튀_렌라쿠_2.png; 유각입찰먹튀_렌라쿠_3.png; 유각입찰먹튀_렌라쿠_4.png,유각,65200605; 65201505; 65203105; 65203905; 65200805; 65203305; 65204105; 65201005; 65203705; 65203505; 65202805; 65200505; 65203005
선필 승부사 유각 읽었는데,https://www.inven.co.kr/board/lostark/6271/2047344, 이쁜궁디빵야,2025-05-26 23:02,전선 카던 변한게 없음  나 호구,,유각,65200605; 65201505; 65203105; 65203905; 65200805; 65203305; 65204105; 65201005; 65203705; 65203505; 65202805; 65200505; 65203005
유각먹튀범 렌라쿠박제,https://www.inven.co.kr/board/lostark/5355/230295, Seongyean,2025-05-26 23:02,"■ 작성 목적   [제보, 해명, 사과 중 선택]  제보  ■ 게임 닉네임 ※ 작성자 계정 스크린샷 미첨부 시 삭제 될 수 있습니다   작성자: 닉네임 성연  대상자: 닉네임 렌라쿠 / 보리로그리는그림 / 갈치보단명치 / 깅여울 / 우바다 / 총쭈    ■ 사건 설명   * 발생 날짜  : 2025-05-26 11시경    * 사건 내용  : 노말2막 4인버스끝나고 타대가 나왔는데 경매미참으로 탑승하여 타격의대가 유각에 5만골입찰후 도주   ■ 증거 자료(스크린샷, 동영상)     ■ 요약 내용",유각먹튀범_렌라쿠박_1.png,유각,65200605; 65201505; 65203105; 65203905; 65200805; 65203305; 65204105; 65201005; 65203705; 65203505; 65202805; 65200505; 65203005
전분말고 미터기가 나와야됨,https://www.inven.co.kr/board/lostark/6271/2047302, 정글러의꿈,2025-05-26 22:51,7멸홍으로 가토 매칭돌렸는데  47퍼 밑잔임 물론 난 풀유각 나이스단인데 7멸 수라결에 천왕셋팅이고 재내 둘다 8겁작 딜러임 근데 재들보다 거의 두배 가까이 넣음  마지막에 ㅋ 치고 나가는 싸가지 없는 새끼 ㅉㅉ 재낸 레이드도 저딴식으로 유튜브보면서 하고 있을듯,전분말고_미터기가_1.jpg; 전분말고_미터기가_2.jpg,유각,65200605; 65201505; 65203105; 65203905; 65200805; 65203305; 65204105; 65201005; 65203705; 65203505; 65202805; 65200505; 65203005
유각 대량으로 싸게올렸습니다 사가세요,https://www.inven.co.kr/board/lostark/6271/2047276, Leonlist,2025-05-26 22:45,최저가 많관부,유각_대량으로_싸게_1.png,유각,65200605; 65201505; 65203105; 65203905; 65200805; 65203305; 65204105; 65201005; 65203705; 65203505; 65202805; 65200505; 65203005
재학이는 보석 떨어지든 말든 알빠노임 ㅋㅋ,https://www.inven.co.kr/board/lostark/6271/2047164, 옴모나,2025-05-26 22:23,유각은 팔아야되니까 너무 과했다고 잠궜는데  보석은 알빠노?팔것도 아닌데 ㅋㅋㅋ떨어지든말든,,유각,65200605; 65201505; 65203105; 65203905; 65200805; 65203305; 65204105; 65201005; 65203705; 65203505; 65202805; 65200505; 65203005
보석이건 유각이건 더 쳐박아라,https://www.inven.co.kr/board/lostark/6271/2047150, 이쁜궁디빵야,2025-05-26 22:20,원래 로아는 그냥 개나소나 교복입고 최종 컨텐츠 때려잡는 게임이었거든  점점 다가간다 그시절로,,유각,65200605; 65201505; 65203105; 65203905; 65200805; 65203305; 65204105; 65201005; 65203705; 65203505; 65202805; 65200505; 65203005
난 이번포셔영상은 잘 모르겠음,https://www.inven.co.kr/board/lostark/6271/2047151, 행모,2025-05-26 22:20,"1640나이스는 왜 레벨을안올리고 비나이스는 레벨을 올릴거라고 생각하지? 나이스는 80찍는거? 템렙만찍으면됨 근데 비나이스는? 보석, 유각 이걸 고려해야할수밖에 없음 사실 배럭을 부캐급으로 올리는건 오히려 나이스들이 더함 물론 다계정1640나이스 쌀팔이들도 있긴할건데 이건 논외지",,유각,65200605; 65201505; 65203105; 65203905; 65200805; 65203305; 65204105; 65201005; 65203705; 65203505; 65202805; 65200505; 65203005
이번주 먹은 유각,https://www.inven.co.kr/board/lostark/6271/2047139, 티콘,2025-05-26 22:18,"슈차1, 타대1, 마흐1, 원한1, 예둔1",,유각,65200605; 65201505; 65203105; 65203905; 65200805; 65203305; 65204105; 65201005; 65203705; 65203505; 65202805; 65200505; 65203005
더떨어지는건무서운데이쯤되니보석효율개좋아짐,https://www.inven.co.kr/board/lostark/6271/2047098, 서풍,2025-05-26 22:09,악세유각다같이떡락하는거아니면결국다시맞춰야해서팔지도못함..,,유각,65200605; 65201505; 65203105; 65203905; 65200805; 65203305; 65204105; 65201005; 65203705; 65203505; 65202805; 65200505; 65203005
2년안에 유각 100크리당 10개 가능할까??,https://www.inven.co.kr/board/lostark/6271/2047096, 시래기감자탕,2025-05-26 22:08,전각도 10개에 100크리에 팔았는데  2년뒤에 유각도 그럴 가능성 있음??,,유각,65200605; 65201505; 65203105; 65203905; 65200805; 65203305; 65204105; 65201005; 65203705; 65203505; 65202805; 65200505; 65203005
유각 굳이 시세 올린건 유각 패키지로 팔겠다는 거임,https://www.inven.co.kr/board/lostark/6271/2047076, 화생방,2025-05-26 22:03,그 16만5000원에 1장 줄때 매출 달달했어서 계속 그럴거임 현재 매출 땡길방법이 그거 밖에 없거든 곧 있으면 카드패키지처럼 점점늘어서 뭔 패키지를 사면 보너스라면서 5장씩 줄걸  뻔하다 뻔해,,유각,65200605; 65201505; 65203105; 65203905; 65200805; 65203305; 65204105; 65201005; 65203705; 65203505; 65202805; 65200505; 65203005
로아는 하면할수록 락걸어놓은 계정 아닌계정 있는거같아 씨ㅣㅣㅣㅣㅣㅣㅣㅣㅣㅣㅣㅣㅣㅣㅣㅣㅣㅣㅣㅣ발,https://www.inven.co.kr/board/lostark/6271/2047063, 아방oooo,2025-05-26 22:00,뭘해도 되는사람 편린골드 쥰내 쳐먹고 유효유각 쥰내 쳐먹고 레이드만 돌았다하면 카드나오는 사람이있는가하면  나처럼 한없이 불쌍하고 가혹한 유저가 있는거시에양 ㅠㅠㅠㅠㅠㅠㅠㅠㅠㅠㅠ,,유각,65200605; 65201505; 65203105; 65203905; 65200805; 65203305; 65204105; 65201005; 65203705; 65203505; 65202805; 65200505; 65203005
아니씨발 그래서 나이스 해 말어 ㅜㅜㅜ,https://www.inven.co.kr/board/lostark/6271/2047036, 왕의품격,2025-05-26 21:54,유각 어쩔건데... 나이스 해말어 귀속골드오면 나이스 할이유가없자나 장남장녀키우기가안되는데...  형들 정답을알려줘!!,,유각,65200605; 65201505; 65203105; 65203905; 65200805; 65203305; 65204105; 65201005; 65203705; 65203505; 65202805; 65200505; 65203005
나도 재밋게 게임하고싶다고,https://www.inven.co.kr/board/lostark/6271/2047021, Hitachi마코,2025-05-26 21:51,니들만 편린으로 20만골드먹고 골두꺼비로 아드유각복사하고 강습하드에서 아드먹고 50만 먹으면서 에스더의기운까지먹냐  나도 저중에 하나라도 즐기고싶다고  왜 니들만 즐기냐고,,유각,65200605; 65201505; 65203105; 65203905; 65200805; 65203305; 65204105; 65201005; 65203705; 65203505; 65202805; 65200505; 65203005
이쯤되니깐 진심 로아온이 궁금해진다.,https://www.inven.co.kr/board/lostark/6271/2046932, 어쎄싱이에요,2025-05-26 21:27,도대체 언제까지 기달려달라를 시전할지 모르겠지만  이 지경에서 도대체 어떤 방법으로 경제를 살리고 유각 시세를 잡고 보석 감가도 막으면서 카제로스까지 이끌어갈지 진짜 궁금하지 않음?ㅋㅋㅋㅋㅋㅋㅋㅋㅋㅋ  설마 한 4~6개월 기다려 시전하겠어?,,유각,65200605; 65201505; 65203105; 65203905; 65200805; 65203305; 65204105; 65201005; 65203705; 65203505; 65202805; 65200505; 65203005
여름 로아온 이후 피방보상에 유각 3장은 줄꺼 같지 않음??,https://www.inven.co.kr/board/lostark/6271/2046878, Dental,2025-05-26 21:17,유입 입장에서 차트 아웃인 게임할바에는 던파 메이플 할꺼 같은데,,유각,65200605; 65201505; 65203105; 65203905; 65200805; 65203305; 65204105; 65201005; 65203705; 65203505; 65202805; 65200505; 65203005
악세값은 왜케 오르냐,https://www.inven.co.kr/board/lostark/6271/2046863, 뉴비에오,2025-05-26 21:13,유각 밎추다 비싸져서 뭔가 손해보는 느낌들어서 악세나 기웃거리고 있는데 어제도 비싸서 포기했는데 오늘 더 올랐네 ㅂㄷㅂㄷ 다 나같은 생각인건가,,유각,65200605; 65201505; 65203105; 65203905; 65200805; 65203305; 65204105; 65201005; 65203705; 65203505; 65202805; 65200505; 65203005
왜 광휘 패치가 철회라는 거임?,https://www.inven.co.kr/board/lostark/6271/2046831, 숙코파괴자,2025-05-26 21:04,"유저들이 원한 보석 변경은 겁작변환 자유 & 스킬변환 확정이 메인이고, 추가 공격력 및 캐릭귀속은 개발진이 돈벌려고 추가한 개수작인데 개발진 개수작 쳐냈으면 유저가 원한 패치가 제대로 들어온 거 아님?  11렙 보석이 나오는 거면 차라리 이해하겠는데 그냥 귀속딸깍하는 것만으로 기존 보석보다 밸류가 올라가는 패치에 불만을 가지면 안되는 이유라도 있는지 궁금하네  모든 캐릭이 상향이라고? 극딜캐릭이 딜파이 먹는게 커지면 지딜이 약해지고 보스 체력 뻥튀기하면 지딜이 올라오는게 로아인데 그냥 옆그레이드라고 진심으로 생각하는거 아니지?  라방 하나에 패치 내용이 뒤집히는게 말이 안된다고? 라방 하나에 보석 추가공격력 붙는 건 말이 된다고 생각하냐? 차라리 돌려 말하지 말고 솔직하게 말하라니까.  보석 존나 비싸서 감당 안되는데 날먹하는 나이스단 쳐 죽여달라고. 저새끼가 쌀먹인지 아닌지 모르겠지만 나보다 레이드 편하게 가니까 죽여달라고. 유각이고 세팅이고 저새끼 따라 갈 자신 없으니까 저새끼가 나보다 손해보게 하라고  솔직하면 밉긴해도 좆같진 않은데 구라쟁이기까지 하면 안갈라지고는 못버티는거임.",,유각,65200605; 65201505; 65203105; 65203905; 65200805; 65203305; 65204105; 65201005; 65203705; 65203505; 65202805; 65200505; 65203005
의외로 80까지 비용 절감할 방법은 좀 많긴함,https://www.inven.co.kr/board/lostark/6271/2046812, Wmod,2025-05-26 20:59,8겁작에 대충 유각 한두개 돌려먹고 하면  1680 원정대 적당히 균등 강화에 유각 1~2개 돌려먹기 배럭급 세팅만 적당히 해줘도  한 1400점 찍고 무난하게 숙제 다 빼기 최적인데  반대로 주차만 충분히 해뒀다면  1660 - 1680 까지 돌파석은 3천개 정도 있으니까  상재 10 +16 목표로 큐브 날잡고 싹다 조진 뒤 에포나로 쌓아둔 귀속 숨결 싹다 합치면  아비도스는 사고 해도 얼추 50만골 전후로 80 찍히긴 찍힘  이 정도면 의외로 회수하는데 오래 안걸림  1660 배럭이 1.8+1.1+1.1라 4만골인데 1680 찍으면 8만골로 부웅 날아감  근데 이후는 뭔 수단을 써도 회수가 불가능함  1680에서 다들 배럭 시마이 치는 게 문제인듯? 이 이후는 솔직히 뭔 견적 내도 회수가 안됨,의외로_80까지_비_1.jpg,유각,65200605; 65201505; 65203105; 65203905; 65200805; 65203305; 65204105; 65201005; 65203705; 65203505; 65202805; 65200505; 65203005
감가피한다고 유각 안사고 무강하고 악세사고,https://www.inven.co.kr/board/lostark/6271/2046724, 환수사v,2025-05-26 20:39,아이러니하게 그나마 감가 덜한게 유각이네,,유각,65200605; 65201505; 65203105; 65203905; 65200805; 65203305; 65204105; 65201005; 65203705; 65203505; 65202805; 65200505; 65203005
걍 리부트화 하자ㅇㅇ,https://www.inven.co.kr/board/lostark/6271/2046699, 각진,2025-05-26 20:34,골드 획득 5배 보석 획득 5배 각종 재련재료 20배 실링 10배 유효 유각 드랍률 5% 6회제한 없음  카던 명파 수급 제한없음 매일카던 1000회도 가능 대신 1카던당 30분걸림 30분다채워야 명파들어옴  대신 올 거래제한  운빨 ㅈ망겜메타 로부트 서버 오픈ㄱㄱ  솔찍히 재밌어보이면 개추,,유각,65200605; 65201505; 65203105; 65203905; 65200805; 65203305; 65204105; 65201005; 65203705; 65203505; 65202805; 65200505; 65203005
시발 유각 가격보니까 또 현타오네,https://www.inven.co.kr/board/lostark/6271/2046575, 엿그랩,2025-05-26 20:04,이번에 예둔 다섯장 사고나서 남은 숙제로 번 30만골에  다음주 클골 40만골을 합쳐도 예둔 마지막 다섯장을 못읽어 ㅅㅂ,,유각,65200605; 65201505; 65203105; 65203905; 65200805; 65203305; 65204105; 65201005; 65203705; 65203505; 65202805; 65200505; 65203005
이제 유각은 매일이 저점인가,https://www.inven.co.kr/board/lostark/6271/2046561, 몽개,2025-05-26 20:01,이제 유두꺼비 끝나니까 올라갈일만 남았겠지?!,,유각,65200605; 65201505; 65203105; 65203905; 65200805; 65203305; 65204105; 65201005; 65203705; 65203505; 65202805; 65200505; 65203005
pm8시 카게 가시는 분들 다들 유각 득템하시길,https://www.inven.co.kr/board/lostark/6271/2046539, 귀요미얌,2025-05-26 19:57,기도,,유각,65200605; 65201505; 65203105; 65203905; 65200805; 65203305; 65204105; 65201005; 65203705; 65203505; 65202805; 65200505; 65203005
